{
  "dispute_id": "77777777-7777-4777-8777-777777777777",
  "settlement_id": "55555555-5555-4555-8555-555555555555",
  "unit_refs": [
    {
      "buyer_principal_hash": "0xd6d6d6d6d6d6d6d6d6d6d6d6d6d6d6d6d6d6d6d6d6d6d6d6d6d6d6d6d6d6d6d6"
    }
  ],
  "challenger_principal_id": "11111111-1111-4111-8111-111111111111",
  "bond": "100000000",
  "reason_code": "FUNCTIONAL_TEST_FAILED",
  "evidence": [
    "0xe8e8e8e8e8e8e8e8e8e8e8e8e8e8e8e8e8e8e8e8e8e8e8e8e8e8e8e8e8e8e8e8"
  ],
  "encrypted_evidence_ref": "https://evidence.caravan-testnet.example/disputes/77777777-7777-4777-8777-777777777777/package.enc",
  "panel": {
    "members": [
      "operator-01",
      "operator-02",
      "operator-03"
    ],
    "ruling": "UPHELD",
    "ruling_predicate_trace": "https://verify.caravan-testnet.example/predicate-trace/77777777-7777-4777-8777-777777777777"
  },
  "appeal": null,
  "outcome": "UPHELD",
  "slashes": [
    {
      "target_principal_id": "22222222-2222-4222-8222-222222222222",
      "amount": "100000000",
      "reason": "functional_activation_test_failure"
    }
  ]
}
